{
 "$schema": "./phase-muscles.schema.json",
 "generatedFrom": "design/muscle-sync@43da6c8 src/flare-phase-muscles.js + src/flare-muscle-groups.js + src/muscle-map.js + public/coach/flare-sequence.json",
 "note": "教学重点，不是肌电（EMG）；颜色只区分肌群，不表示用力大小。",
 "sections": [
  {
   "id": "support",
   "label": "支撑（肩臂）",
   "short": "支撑"
  },
  {
   "id": "core",
   "label": "核心折叠",
   "short": "核心"
  },
  {
   "id": "legs",
   "label": "腿部绕环",
   "short": "腿部"
  }
 ],
 "groups": [
  {
   "groupId": "deltoids",
   "section": "support",
   "colour": "#4cc9f0",
   "label": "三角肌",
   "view": "front",
   "role": "前、中、后束协同控制承重肩，接住每一次换手。",
   "panels": [
    "deltFront",
    "deltSide",
    "deltRear"
   ],
   "deep": false
  },
  {
   "groupId": "rotator-cuff",
   "section": "support",
   "colour": "#a29bfe",
   "label": "肩袖肌群",
   "view": "back",
   "role": "位于深层，帮助稳定肱骨头，支撑方向不断变化时护住肩关节。",
   "note": "仅用冈下肌位置示意（斜线＝深层）；冈上肌、小圆肌、肩胛下肌未单独绘制。",
   "panels": [
    "infraspinatus"
   ],
   "deep": true
  },
  {
   "groupId": "triceps",
   "section": "support",
   "colour": "#2f6bff",
   "label": "肱三头肌",
   "view": "back",
   "role": "伸肘锁住支撑臂，手臂保持伸直受控。",
   "panels": [
    "triceps"
   ],
   "deep": false
  },
  {
   "groupId": "forearms",
   "section": "support",
   "label": "前臂 · 腕屈伸肌",
   "colour": "#9ad1e8",
   "view": "front",
   "role": "掌根撑地时控制手腕与手指，平稳落手、卸载。",
   "note": "屈肌群与伸肌群各合为一块面板；手部小肌群未绘制。",
   "panels": [
    "forearmFlex",
    "forearmExt"
   ],
   "deep": false
  },
  {
   "groupId": "serratus",
   "section": "support",
   "colour": "#5eead4",
   "label": "前锯肌",
   "view": "front",
   "role": "让肩胛贴着胸廓前伸，主动把地面推远。",
   "note": "只画出胸廓侧面可见的部分；被肩胛骨覆盖的部分未绘制。",
   "panels": [
    "serratus"
   ],
   "deep": false
  },
  {
   "groupId": "scapular",
   "section": "support",
   "label": "斜方肌中下部 · 菱形肌",
   "colour": "#86efc4",
   "view": "back",
   "role": "协同调整肩胛位置，维持肩带与地面之间的支撑空间。",
   "note": "菱形肌在斜方肌深层，这里与斜方肌中下部合为一块面板。",
   "panels": [
    "scapular"
   ],
   "deep": false
  },
  {
   "groupId": "chest",
   "section": "support",
   "colour": "#6f8dff",
   "label": "胸大肌",
   "view": "front",
   "role": "前撑转侧撑时，配合控制上臂相对胸廓的方向。",
   "panels": [
    "pec"
   ],
   "deep": false
  },
  {
   "groupId": "lats",
   "section": "support",
   "colour": "#00a896",
   "label": "背阔肌",
   "view": "back",
   "role": "连接上臂与躯干，参与肩部下压与身体随支撑转移。",
   "panels": [
    "lats"
   ],
   "deep": false
  },
  {
   "groupId": "abs",
   "section": "core",
   "colour": "#c466ff",
   "label": "腹直肌（含深层腹横肌）",
   "view": "front",
   "role": "卷腹折叠躯干，与深层腹横肌一起稳住骨盆，给抬腿留出空间。",
   "note": "面板为腹直肌；腹横肌位于深层，没有单独面板。",
   "panels": [
    "abs"
   ],
   "deep": false
  },
  {
   "groupId": "obliques",
   "section": "core",
   "colour": "#ff6fb5",
   "label": "腹斜肌",
   "view": "front",
   "role": "参与躯干旋转与侧向控制，让肩与骨盆随摆腿转动。",
   "note": "面板为腹外斜肌；腹内斜肌在其深层，未单独绘制。",
   "panels": [
    "oblique"
   ],
   "deep": false
  },
  {
   "groupId": "erectors",
   "section": "core",
   "colour": "#e3b3ff",
   "label": "竖脊肌",
   "view": "back",
   "role": "控制脊柱伸展与躯干位置，后撑时帮助保持髋高。",
   "note": "腰方肌（腰部深层）暂无面板，未显示。",
   "panels": [
    "erectors"
   ],
   "deep": false
  },
  {
   "groupId": "hip-flexors",
   "section": "core",
   "colour": "#ff9ec7",
   "label": "髋屈肌",
   "view": "front",
   "role": "位于骨盆深处，主动屈髋，把长腿从身体前方抬过去。",
   "note": "髂腰肌在深层（斜线），与阔筋膜张肌合为一块面板示意；股直肌见股四头肌。",
   "panels": [
    "hipFlexor"
   ],
   "deep": true
  },
  {
   "groupId": "glute-max",
   "section": "legs",
   "colour": "#ffb703",
   "label": "臀大肌",
   "view": "back",
   "role": "髋伸展与后方扫腿（深层髋旋转肌配合调整腿的方向）。",
   "note": "深层髋外旋肌群没有单独面板。",
   "panels": [
    "glutes"
   ],
   "deep": false
  },
  {
   "groupId": "hip-abductors",
   "section": "legs",
   "colour": "#ff7b2e",
   "label": "臀中肌 · 髋外展",
   "view": "back",
   "role": "主动开腿并控制骨盆，离地后双腿不合拢。",
   "note": "臀小肌在臀中肌深层，未单独绘制。",
   "panels": [
    "gluteMed"
   ],
   "deep": false
  },
  {
   "groupId": "adductors",
   "section": "legs",
   "colour": "#b5e655",
   "label": "内收肌群",
   "view": "front",
   "role": "控制腿向中线回收与开度变化，衔接下一段扫腿。",
   "note": "长收肌、短收肌、大收肌、股薄肌合为一块面板。",
   "panels": [
    "adductors"
   ],
   "deep": false
  },
  {
   "groupId": "quadriceps",
   "section": "legs",
   "colour": "#ffe45c",
   "label": "股四头肌",
   "view": "front",
   "role": "保持膝部伸直，让长腿连续绕行。",
   "note": "股中间肌位于深层，未单独绘制。",
   "panels": [
    "quadRect",
    "quadLat",
    "quadMed"
   ],
   "deep": false
  },
  {
   "groupId": "hamstrings",
   "section": "legs",
   "colour": "#e9a46a",
   "label": "腘绳肌",
   "view": "back",
   "role": "后侧长腿线条，参与髋伸与膝部控制。",
   "panels": [
    "hamLat",
    "hamMed"
   ],
   "deep": false
  }
 ],
 "phases": [
  {
   "source": 9,
   "id": "rear-support",
   "name": "后侧支撑",
   "detail": "长腿过前方",
   "caption": "双手推地撑住身体，屈髋把开立的长腿抬过身体前方；腹部卷紧，臀中肌保持开腿。",
   "primary": [
    {
     "id": "triceps",
     "side": "support",
     "why": "双臂伸直锁肘，把身体撑离地面。"
    },
    {
     "id": "deltoids",
     "side": "support",
     "why": "肩前倾在手的上方，控制承重肩。"
    },
    {
     "id": "hip-flexors",
     "side": "both",
     "why": "主动屈髋，把长腿抬过身体前方。"
    },
    {
     "id": "abs",
     "side": "both",
     "why": "卷腹折叠躯干，给抬腿留出空间。"
    },
    {
     "id": "hip-abductors",
     "side": "both",
     "why": "双腿保持大开度，过前方时不合拢。"
    }
   ],
   "secondary": [
    {
     "id": "serratus",
     "side": "support"
    },
    {
     "id": "forearms",
     "side": "support"
    },
    {
     "id": "adductors",
     "side": "both"
    },
    {
     "id": "quadriceps",
     "side": "both"
    }
   ]
  },
  {
   "source": 10,
   "id": "first-transfer",
   "name": "第一侧移重",
   "detail": "单手接重",
   "caption": "重量从双手移到单手：支撑侧三角肌、肱三头肌和前锯肌一起接住体重，腕屈肌稳住掌根；腹斜肌把骨盆转向侧面。",
   "primary": [
    {
     "id": "deltoids",
     "side": "support",
     "why": "整个上身的重量转到这一侧肩上。"
    },
    {
     "id": "triceps",
     "side": "support",
     "why": "支撑臂伸肘锁住，不让手肘弯塌。"
    },
    {
     "id": "serratus",
     "side": "support",
     "why": "肩胛贴住胸廓前伸，主动把地面推远。"
    },
    {
     "id": "forearms",
     "side": "support",
     "why": "掌根刚接住体重，腕屈肌控制手腕不塌。"
    },
    {
     "id": "obliques",
     "side": "both",
     "why": "转动躯干，让骨盆跟着摆腿转向侧面。"
    }
   ],
   "secondary": [
    {
     "id": "rotator-cuff",
     "side": "support"
    },
    {
     "id": "hip-abductors",
     "side": "free"
    },
    {
     "id": "glute-max",
     "side": "support"
    }
   ]
  },
  {
   "source": 11,
   "id": "first-support",
   "name": "第一侧支撑",
   "detail": "高 V 开腿",
   "caption": "单手撑起全身、身体侧立：支撑肩最吃力，肩袖护住肩关节；腹斜肌把髋撑高，臀中肌打开高 V 字腿。",
   "primary": [
    {
     "id": "deltoids",
     "side": "support",
     "why": "单臂承担全身重量，肩部负荷最大的时刻。"
    },
    {
     "id": "triceps",
     "side": "support",
     "why": "手臂保持笔直，身体才能侧立撑高。"
    },
    {
     "id": "rotator-cuff",
     "side": "support",
     "why": "手臂举过头承重，肩袖把肱骨头稳在关节里。"
    },
    {
     "id": "obliques",
     "side": "both",
     "why": "侧面核心把骨盆撑高，身体不往下塌。"
    },
    {
     "id": "hip-abductors",
     "side": "both",
     "why": "臀中肌外展双腿，撑开高 V 字。"
    }
   ],
   "secondary": [
    {
     "id": "serratus",
     "side": "support"
    },
    {
     "id": "forearms",
     "side": "support"
    },
    {
     "id": "lats",
     "side": "support"
    },
    {
     "id": "adductors",
     "side": "both"
    }
   ]
  },
  {
   "source": 12,
   "id": "first-pass",
   "name": "第一侧换腿",
   "detail": "准备回撑",
   "caption": "身体转向正面，双腿像剪刀一样换位过前：屈髋肌和腹直肌把腿带到前方，内收肌控制两腿交错；另一只手准备回撑。",
   "primary": [
    {
     "id": "triceps",
     "side": "support",
     "why": "仍是单手支撑，伸肘把身体顶住。"
    },
    {
     "id": "deltoids",
     "side": "support",
     "why": "身体转向正面，承重肩随之转动控制。"
    },
    {
     "id": "hip-flexors",
     "side": "both",
     "why": "屈髋把扫行的腿带到身体前方。"
    },
    {
     "id": "abs",
     "side": "both",
     "why": "收腹折叠，骨盆抬住，给腿让出通道。"
    },
    {
     "id": "adductors",
     "side": "both",
     "why": "两腿剪刀式交错，内收肌控制开合。"
    }
   ],
   "secondary": [
    {
     "id": "obliques",
     "side": "both"
    },
    {
     "id": "quadriceps",
     "side": "both"
    },
    {
     "id": "serratus",
     "side": "support"
    },
    {
     "id": "forearms",
     "side": "support"
    }
   ]
  },
  {
   "source": 13,
   "id": "front-support",
   "name": "前侧支撑",
   "detail": "开腿扫后方",
   "caption": "双手在身后撑地、胸口朝上：肱三头肌、三角肌和胸大肌像做臂屈伸一样顶住身体；双腿保持大开度，准备向后扫。",
   "primary": [
    {
     "id": "triceps",
     "side": "support",
     "why": "双手在身后推地，伸肘把身体顶起。"
    },
    {
     "id": "deltoids",
     "side": "support",
     "why": "肩在后伸位承重，前束最吃力。"
    },
    {
     "id": "chest",
     "side": "support",
     "why": "胸大肌协助肩部在后伸位推地。"
    },
    {
     "id": "hip-abductors",
     "side": "both",
     "why": "双腿抬高大开度，准备向后扫。"
    }
   ],
   "secondary": [
    {
     "id": "scapular",
     "side": "support"
    },
    {
     "id": "hip-flexors",
     "side": "both"
    },
    {
     "id": "abs",
     "side": "both"
    },
    {
     "id": "forearms",
     "side": "support"
    },
    {
     "id": "glute-max",
     "side": "both"
    }
   ]
  },
  {
   "source": 14,
   "id": "second-transfer",
   "name": "第二侧移重",
   "detail": "换手接重",
   "caption": "换到另一只手单撑：支撑侧肩臂和前锯肌重新接住体重，腕屈肌稳住掌根；臀大肌带长腿从前方扫向后方。",
   "primary": [
    {
     "id": "deltoids",
     "side": "support",
     "why": "体重换到这一侧肩上，重新接住。"
    },
    {
     "id": "triceps",
     "side": "support",
     "why": "新的支撑臂伸肘锁住。"
    },
    {
     "id": "serratus",
     "side": "support",
     "why": "肩胛前伸推地，肩不往下沉。"
    },
    {
     "id": "forearms",
     "side": "support",
     "why": "掌根刚接重，腕屈肌控制手腕。"
    },
    {
     "id": "glute-max",
     "side": "both",
     "why": "伸髋发力，把长腿从前方扫向后方。"
    }
   ],
   "secondary": [
    {
     "id": "rotator-cuff",
     "side": "support"
    },
    {
     "id": "obliques",
     "side": "both"
    },
    {
     "id": "hip-abductors",
     "side": "free"
    },
    {
     "id": "hamstrings",
     "side": "both"
    }
   ]
  },
  {
   "source": 15,
   "id": "second-support",
   "name": "第二侧支撑",
   "detail": "高 V 开腿",